Risk ID,Risk Description,Impact,Project Stage,Risk Category,Likelihood (1-10),Impact (1-10),Risk Index,Risk Owner,Mitigation
3,failure to discharge planning and listed building conditions,,pre construction,planning,3.333333333333333,1.6666666666666667,2.0,project manager,design team and contractor to collate initial pack of information for discharge of conditions
4,planning conditions impact on budget,increase project budget,pre construction,planning,6.666666666666667,5.0,14.0,project manager,extent of conditions known and to be reviewed and managed
10,electricity provider works delayed or non conforming,works to provide new supply are delayed not in accordance with the programme to save having to provide a sub station,construction,legislation,3.333333333333333,3.333333333333333,4.0,project manager,orders for the electrical services have been placed by cyc direct
11,building control sign off delay due to lack of resources,revisit design to address concerns of building control,construction commissioning,legislation,3.333333333333333,3.333333333333333,4.0,project manager,continue liaison with the building control officer
12,impact of boat companies city cruises,impact delivery site servicing strategy,construction,planning,3.333333333333333,1.6666666666666667,2.0,project manager,legal agreements are in place
13,party wall negotiations construction access,objection from neighbours potential delay to programme,pre construction,planning,5.0,6.666666666666667,10.5,project manager,appoint party wall surveyor and progress discussions with neighbours
14,failure to secure market interest for restaurant tenant,restaurant not achieving appropriate tenant and long term revenue projections impact on project cost,pre construction operation,procurement,5.0,8.333333333333334,15.0,project manager,early engagement of agent for potential lettings sufficient expressions of interest
16,increased construction costs,exchange rate on materials impact of international markets following political decisions,construction,procurement,5.0,5.0,9.0,project manager,tender prices received and under review risk shall remain prominent where budget costs provisional sums are included
18,sub contractor insolvency,impacts main contractor,construction,procurement,6.666666666666667,5.0,12.0,construction manager,contractor financial checks and vetting of subcontractors
20,surveys required to determine ground conditions contamination,possible need to re visit design deal with contamination on site,pre construction,surveys,1.6666666666666667,8.333333333333334,3.0,lead engineer,gi survey undertaken information obtained contamination results received desk study provided by arup
21,identification of active movement,proven to be active remediation impacts cost,pre construction,surveys,1.6666666666666667,8.333333333333334,5.0,structural engineer,ongoing monitoring by arup and monitoring specification included within contract documents
22,unidentified archaeology,further evaluation required cost impact,pre construction,surveys,3.333333333333333,3.333333333333333,4.0,environment lead,evaluation of site undertaken
23,additional surveys required,cost impact,pre construction,surveys,1.6666666666666667,1.6666666666666667,1.0,project manager,undertake outstanding surveys
26,unrealistic programme submitted by contractor,,pre construction,programme,1.6666666666666667,5.0,2.5,project manager,market tested
27,programme delays due to flood levels impacting construction,works stop cost and programme implications,construction,programme,10.0,8.333333333333334,24.0,project manager environment lead,review historic flood data and issue to contractor contingency plan to be developed
29,delay to design programme,client contractor impact cost programme,pre construction,design,5.0,5.0,9.0,design manager,implementation of irs schedules design deliverables and clear responsibility for design
31,underpinning piling and crack repairs to be considered,may resolve existing cracks and movement of the tower but other cracks may appear elsewhere that will require repairing,pre construction,design,5.0,8.333333333333334,15.0,structural engineer,detailed dilapidations surveys crack monitors
32,discovering structural unknowns,costs of additional surveys and remediation works,construction,design,8.333333333333334,6.666666666666667,17.5,structural engineer,undertake surveys early to determine unknowns allow suitable contingency for remediation biggest concerns being the tower underpinning and south range
35,undetected services not identified on surveys and drawings,programme re design cost impact to address unknown,construction,services,3.333333333333333,5.0,6.0,lead engineer,utilities surveys maps obtained and plotted on sga drawings careful excavation groundworks when on site
40,river source heat pump license approval by the environment agency refused,delay in no approval from ea,pre construction,services,1.6666666666666667,6.666666666666667,4.5,environment lead,provisional consent obtained continued dialogue required
41,sourcing stone for remediation works,quarry that stone exists from is closed impacts programme and different stone requires further approval from historic england and the planning authority,construction,materials,6.666666666666667,5.0,12.0,procurement manager,investigate other quarries which supply the stone liaise with historic england and the planning authority to have an alternative approved
42,structural damage and the repairs required to the tower,finding the right solution to undertake the underpinning works,construction,construction,6.666666666666667,6.666666666666667,14.0,structural engineer,bullivants arup design and vinci temporary works design to be reviewed in detail to mitigate any consequential delay building monitoring systems and locations to be agreed
48,outstanding defects remaining unresolved,cyc left with legacy issues and building defects which need resolving impact on tenant occupation satisfaction,commissioning,post contract,3.333333333333333,5.0,4.0,project manager,ability to resolve within the building contract use of retention
50,costs exceeds allocated budget non construction costs,particular risks surrounding consultant fees furniture fit out works etc,construction commissioning,financial,8.333333333333334,5.0,15.0,project manager,review non construction costs prior to contract award and during construction
51,incorrect estimation design errors and ambiguities,construction cost overrun,pre construction,financial,5.0,5.0,9.0,design manager,risk sits with cyc except cdp items
56,availability of specialist labour equipment,change in specification need to appoint specialists commission bespoke works,construction,construction,5.0,5.0,9.0,project manager,dialogue with main contractor supply chain
61,poor co ordination with design team interfaces contractor design portions,,construction,design,3.333333333333333,5.0,6.0,design manager,cdp requirements have reduced from initial intent regular meetings to be held with vinci and design team to discuss cdp interfaces
62,rights of light,,pre construction,adjoining owners,1.6666666666666667,6.666666666666667,2.5,project manager,title report does not identify any issues
64,poor contractor performance during construction,,construction,construction,3.333333333333333,8.333333333333334,9.0,project manager,contract to be signed to protect client performance bonds to be obtained
66,unknown south range structures,risk of discovering old basement causing issues with piling proposals,construction,design,6.666666666666667,5.0,12.0,structural engineer,
67,insufficient design detail from specialist cdp packages,impacts the sign off planning conditions listed building consents etc in particular pre commencement conditions,pre construction,design,5.0,1.6666666666666667,6.0,design manager,regular design reviews and interface management
70,satisfying ea requirements,incident occurring which stops the work and action required to resolve the issue ea prohibition,pre construction,design,1.6666666666666667,8.333333333333334,4.5,environment lead,waste management and compliance with the ea to ensure no environmental hazards
72,delay in design programme due to tenant operator requirements,operator changes impacting on cost programme,pre construction,design,5.0,5.0,9.0,design manager,recovery of cost time included within the agreements for lease should late or significant changes be made
73,design changes including client changes variations eot loss expense claims and unforeseen items,construction cost overrun,construction,financial,10.0,8.333333333333334,30.0,project manager,traditional contract risk with cyc secure adequate contingency
75,weather delays,delay to programme wind temp rain,construction,construction,8.333333333333334,5.0,12.5,project manager,contractor to provide impact and allowances via contract
76,underpinning crack repairs by third parties,cracks may appear elsewhere remediation costs,construction,design,3.333333333333333,8.333333333333334,10.0,structural engineer,detailed dilapidations surveys crack monitors
77,ground conditions borehole survey depth insufficient,proposed piling designs impacted by this and require altering time cost impact,pre construction,surveys,5.0,5.0,9.0,lead engineer,additional bore hole surveys indertaken no foundatons obstructions found albeit at relatively shallow depth near tower bullivants arup to review surveys and confirm they are happy with findings vinci to design piling to new structures and confirm site information held is adequate
80,instability to boundary wall following demolition,structural works required piers,construction,design,5.0,3.333333333333333,6.0,structural engineer,assessment of wall structure required scope of works to be determined
81,clashes between the existing building foundations and proposed drainage network no information is available for the existing buildings therefore it has not been possible to co ordinate the height of drainage to pass above under the existing foundation as required,co ordination of drainage with foundations during construction cost impact,construction,surveys,5.0,3.333333333333333,7.5,lead engineer,trial holes could be undertaken to better understand the existing foundations drainage has been designed conservatively to allow for a level of contingency in the design if foundations impact drainage runs
82,potential drainage clash with proposed lift shaft pits,additional external drainage network,construction,surveys,1.6666666666666667,5.0,3.0,lead engineer,trial hole dug in the location and appears to be clear risk to be reviewed again once demoliton of north annex is complete
83,billing omissions or inaccuracies in boq,missing information within the boq resulting in time and cost increases,pre construction,financial,6.666666666666667,8.333333333333334,18.0,project manager,t t have carried out reviews of the boq
84,additional works not covered by contract documents arising from opening up works scope and extent of works greater than assumed etc,cost programme,construction,financial,10.0,8.333333333333334,27.0,project manager,detailed change management process to be followed
85,ongoing movement in the south range given the removal of underpinning from the scheme,underpinning works reinstated resulting in cost and time impact,construction operation,design,3.333333333333333,6.666666666666667,8.0,structural engineer,monitoring during works
87,design change due to level of development and coordination at the point of tender for items such as north annex chimney retaining walls and stairs and movement joints to existing structures,impact on cost and programme changes may delay construction activity impact on sequencing resulting in eot claims,pre construction,design,3.333333333333333,3.333333333333333,5.0,design manager,coordination to be managed by design team as a priority design changes to retaining concrete wall has been instructed by cyc and should be underway by design team
88,council chamber cooling to be approved,revisit of design proposals time and cost,commissioning,design,3.333333333333333,5.0,6.0,design manager,design team to coordinate with planning conservation
